comment,upvotes
">Cutthroat Island  
>  
> \- More like, people have forgotten about it. This movie deserves a lot more than what it got, it's a good pirate flick!

It came out when I was 8 and I absolutely loved it! Imagine my shock when I found out the rest of the world didn't. We didn't really understand how unpopular certain things were until the internet let us know.",7
We’ll post a small monument on that hill for you 😀,5
"Yes! I loved Batman & Robin, not even ironicly. I enjoy the movie. I love Uma Therman. I thought the puns were fitting for the characters, and the art style of the film was unique. And I approve of the nipple suits, I mean, why not?",1
YES Cutthroat Island was one of my favorite movies when I was a kid! It definitely contributed to my lifelong love of Geena Davis.,1
"I like Batman and Robin too, but 90% of the reason I do is Uma Thurman",1
"*Alien³* absolutely doesn't deserve the overwhelming hate it receives. Yeah, it had development issues and ended up messy at times, but somewhere between the theatrical release and the special edition that they cobbled together later lies a truly excellent movie.

""But... But... They killed off Hicks and Newt!""

And it was a bold choice that absolutely paid off. That immediately set the desolate tone for the entire movie and it worked.",1
"Honestly, I like all of the alien movies. Even the clone Ripley.",1
It was my favorite when I was a kid! Rewatched it a few months ago and I like it even more now that I realized that Tywin Lannister is in the movie,1
About time someone said The Postman.  I always liked the teenager who actually sets up a functioning post office and it works.,6
Eeekekekekekekekeek!,1
I disliked it as a kid but I love it now. I think it took life experience and wisdom to understand the symbolism and deep concepts it had to offer.,1
Loved it even bought the soundtrack. Looking at the trash/formulaic superhero movies out today it shines  brighter,1
"I agree, at least this one has an origin story.",1
We are in a very small club but we are members!,1
"OK, I will bite: What did you like about this movie?",1
"Me, too! I thought it was great.",2
"Ah, the non-Ed Norton 2000s Hulk.",1
I liked that. Perfectly good action flick with a great cast.,16
Wait. People didnt like that one?,12
I saw that movie so many times in the theater. I loved it.,9
"1000 times this. Everyone was on point in that movie. I have no clue how it wasn't a hit, everyone was coming off the biggest hits of their careers.",10
"Large swaths of that movie truly suck, but man do I love the scene where they “pilot” the tank through the skies. I wish more of the movie was like that.",3
It’s a fun popcorn movie. A little implausible but entertaining,2
This movie just reminds me of the time in high school that my husband was talking to my sister and me about demons and we were asking him to stop because we were scared and he told us there was a demon in the Bible named Baracus,3
Every time Morgan Freeman opens his mouth it's some of the worst writing ever. But the movie is still awesome.,7
"Oh man, that's why I didn't like it? Where else am I going to get a neuroscience lecture?",1
Lucy was great! I watched it while analyzing data for my master thesis in neuroscience. Great way to spend an evening.,1
"I love this one too, when people bash the ""science"" in movies it makes no sense. Like ya, it's a movie, just pretend it can happen and roll with it. Limitless was the same idea",3
"Dude, I loved that movie back in the day!!",3
"Honestly The Shadow and The Phantom are both fun little time wasters, and you get Alec Baldwin and Billy Zane.",1
"Just chiming in to say I’m with you! I liked it, and the Matrix trilogy, and the second season of Altered Carbon, and the ending of Lost, and pretty much everything else the various fandoms rant about.",1
"This movie suffers from not being what people expected. The first time I watched it, it wasn't the wacky Jim Carrey movie I was looking for. Once those expectations were gone and I saw it again, I loved it. It's a really good, funny movie that gets better the more you watch it.",9
"Oh billy, it's been so long.... since I watched this movie.",1
"I think Waterworld had such massive hype, and people had such high expectations before it was released and people were really disappointed and thus exaggerated how bad it was. It was the most expensive film of all time when it was released.",10
"I loved it as a kid, but I gave it a rewatch as an adult and it's basically two women getting abused on a boat the movie.",5
"""Depends? On what?""   ""No, Depends, we're gonna need some. And about 500 dollars.""",1
"My issue with it was actually in the other direction, I felt it didn't go far enough. There wasn't enough multiverse OR madness by my reckoning. 

Probably my own fault, I went into thinking it would be more unhinged than would have been realistic.",43
"My problem with Multiverse of Madness is the movie title, I was really hoping that this would be *the* multiverse movie of the MCU. Instead we only got to see a few universes and variants. I would've loved to see another Iron Man, another Hulk, another Thor, etc. It's not the end of the Multiverse Saga so I still have some hope but the movie just did not meet my expectations. 

That being said, I still enjoyed the movie and it's among the better Phase 4 movies.",33
Visually one of the more interesting mcu movies for sure,4
"It was just kinda disappointing. It felt like there was no real progression of either the story or the characters. Most of the second act feels like it didn’t change a lot. 

Also it was advertised by YouTubers that it would be a darker, more horror like movie, but it really wasn’t, aside from one jumpscare",9
Not hated but underrated for sure.,19
I generally don't like Ben Stiller in most things and I love this movie,1
Same! I watch it when I need to get out of a slump.,1
Omg I love that movie; I think it got a lot of hate because of the Benjamin button scene but that quote from Sean Penn’s character about not taking the photo and just living in that moment is so insightful,1
I don’t think people hate this movie,1
"This was the first film I saw Eddie redmayne in, and why I can't take him seriously.",5
Hell yes. I wish they had made it a trilogy like they originally planned. It could have been so awesome if the studio had just kept their hands off it.,5
I loved this film!!!!,1
"Here’s my thing with this movie, it tried to do too much in one film. It either needed to be 2-3 movies or a miniseries. The core idea? Good. It’s no stranger than anything else we see in science fiction. Pick any one element a there’s another beloved sci-fi show, movie, or book that does it",1
The genetic-based physical refreshing tech they have in that movie continues to fascinate me. It seems somehow imminently plausible and juuuust out of reach.,1
"Haha, I was looking for this one! I love this movie. It’s so pretty to look at and fun to watch.",2
Jesus,22
"The rabbit hole of "" How did this movie get made""  is better than the movie",1
"I had such high hopes for this. 

I enjoyed films like Amazon Women on the Moon and The Kentucky Fried Movie.

The humor just didn't stick the landings at all in this.",2
"The Turtle Club scene was filmed on 9/11 and once you know that, it sits with you forever",1
"Turtle , turtle...",13
I see you’re AP vote and will raise you “The Love Guru”! Gotta move M. Myers!,1
I thought everyone loved Bring It On?,43
"""*These* are Spirit Fingers!""

This used to air on USA all the damn time, and I'd always find myself watching it, regardless of when I changed the channel.",13
I downvoted you because everyone loves Bring It On. You didn’t answer OP’s question.,1
"In the same vane... Ant Man Quantumania

I feel like the movie gets hate just because hating on Marvel movies is cool now

The movie was entertaining, funny, and moved the cinematic universe forward

Was it perfect... Not by any means... But I still enjoyed it",26
"The reason I hate it, is because of a few reasons:

Thor feels like the most unlikely character to be so goofy. Sure, some people deal with depression through humor, but it didn’t come off that way to me at all

Gorr was completely wasted

The gods too, we’re completely wasted. I’m a massive mythology fan, and when I heard Zeus would be in it, I was HYPED. But they just made it a place to get a McGuffin. We only really met one god, and he was reduced from the most powerful Olympian, so terrifying that he terrified the whole coup staged against him(including Poseidon, Hera, Athena and Apollo), to a fat loser that was obsessed with his orgy

And lastly, the movie just felt inconsequential. It brought back Jane, just to kill her, no actual important characters died(Jane doesn’t count, because she hadn’t done anything since Thor 2) and aside from Thor gaining a daughter, there isn’t any important change from before and after the movie",5
I just wish they would have decided whether it was going to be goofy or serious.  The sort of in-between thing they did didn't really work.,7
"I thought it was ok, not the shit sandwich that everyone made it out to be. It got some laughs and I had fun. 

I do wonder if Taika Waititi JUST listened to appetite for destruction for the first time while making it though.",2
"I loved Thor Love and Thunder. I had fun and was laughing pretty much the whole time, can't ask for more out of a movie experience. I know people say it's too silly, but when you consider that the whole movie is Korg telling the story after it happened, it makes sense why it's not serious and I like it even more.",1
Daddy would you like some sausage?,27
THIS IS A FANCY RESTAURANT!,6
"My and my buddy loved that movie when I was a teen, probably saw it 5 times in theatres. 

*Years* later I was working at a pub. My manager had a guest stay after hours and they were ripping lines at the bar. I recognized this guy, but I figured he was just another bar manager or maybe local celeb, not all that uncommon of an occurrence and just gave em their space.

Anyway, a few days later it hit me. It was one of the stars of that movie. I messaged my buddy who I'd lost contact with over the years, told him what was I saw the other day, a great way to reconnect with an old friend lol",6
"Im the backwards man, the backwards man, I can walk backwards fast as you can, fast as you can, im the backwards man, the backwards man",6
"I saw that at the dollar theater when I was young, and I got ripped off. It’s not worth $1. I’d have to be paid to watch it again. I would’ve walked out but I was dropped off at the theater and didn’t have a way home. 

But I still quote “backwards man” almost every time someone walks backwards, so it’s got that going for it I suppose.",2
"Whenever I hear the word “hooves” in a conversation, I excitedly chime in with “my HOOOOOVES!!!” and nobody ever gets it",1
Where's your LeBaron Freddie?,1
"Yes!  
I watched it recently again after years and was surprised how much i enjoyed it.  
I remember the movie being hated quite a lot when it was released but it was a good movie.",13
"Agree. It took me a minute to settle into the 50's sci-fi B-Movie thing, but once I made the leap, I had a blast.

Is it as good as the other 3? No, but that's a pretty high bar.",1
"Yeah this is what I was going to write! I just found it a fun romp, I didn’t need to take it seriously or anything,  I just switched my brain off and enjoyed myself.",1
The science is pretty bonkers but it is well made and fun,4
"I  love Gravity, simple and straightforward movie, cant find reasons to hate it",2
I went in knowing the twist and all that and the scene where she's being followed in the woods still scared the shit out of me.,1
I liked it even though my roommate spoiled the twist for me.,2
Also liked Lady in the Water,1
"Parts of Spider-Man 2 were shot here in my hometown of Rochester, NY.  The downtown car chase scenes and other parts were shot in 10 days here.  Many of us went downtown and were random people on the street.  They put new signs on most of the buildings during post production.",3
That dubstep score. I enjoyed it a lot,2
"Also TASM 1. Tied with SM 2 for my second favorite SM movie. Great acting, great artstyle, great fights, great villain. And by FAR the best romance of the live action Spider Man movies",2
Battleship is my favorite dumb sci-fi movie.,7
"The scene where the veterans come marching onboard honestly chokes me up every time. My grandfather was a Navy man, and I can totally see him doing that.",1
"Yes, it is a fun movie with good action and actually sort of smart how they incorporated the game aspect into the movie. 

Also that scene with the veterans getting the ship ready always gets me pumped up and somehow a little emotional.",1
"Absolutely, those movies mean so much to me, and while I can understand people not enjoying them, they're very flawed, I really wish I knew more people who love them like I do",1
"I am right there with you, the first two man they were SOOOOO good !!!  
Ironically they didn't even mess up the stupid plots they added which weren't in the book, it's only that they were doomed to fail so the conclusions in the third really messed everything up cuz it was all total bs, but maaaaan they are GOLD, first 2  
altho I can't deny I love the first part of the 3rd movie, just cause it shows the consequences and finally we get to see inside erebor, but that's about it",1
"Ehhh, I'm not a LOTR fan so my opinion is completely unbiased. The hobbit trilogy just felt like there were absolutely no stakes in it. It got to the point where I started scrolling through my phone during fight scenes, that's how low stakes it was. 

As a kids movie, sure it's fine. I wouldn't be recommending it to my friends though.",1
"I agree. I know people were not fans of where Ultron went as a villain, but I loved his operatic, chaotic nature and many allusions to playing God. I felt that Ultron's unpredictability gave him more menace, moments like the one where he cuts Klaue's arm off in particular. And, it makes an excellent contrast with Vision's analytical compassion. The speech between the two of them at the end of the movie is one of my favorite scenes in the MCU",1
"This movie aged really well against the backdrop of Phase 3. I didn't particularly enjoy it at the time, but when I saw where the story ended up, I felt like it was a much better film...definitely much more important in the grand scheme of things.",1
I could listen to James spader talk all the damn day! Such a great villain voice!,1
"I gave it an honest chance, I like Melissa McCarthy and Kate McKinnon, but man it just wasn't funny.  A lot of wasted talent.",13
Same. I made my own screw-u necklace.,6
Edit out thr love story and it's a solid movie.,1
This has an 80/94% critic/audience score on RottenTomatoes and made over $300 million in theatres. That's about as close to a generally loved movie as you can get,37
People hate that movie?,20
It seems to be beloved everywhere except on r/moviescirclejerk.,6
I actually don’t know anyone who hates that movie…,14
"I fucking LOVE Grow Ups! It’s just these 5 dads having the time of their lives being with their families and finally reuniting after like 30 years, and just acting like they’re 17.",1
Banger,2
One of the best soundtracks ever made,1
"One of my all time favourites. It's got everything - romance, aliens, country music, donuts...what's not to like??",1
"The fuck you mean people hate that?

Tom Cruise had a huge ego and it's hard to watch him but that movie was 🔥. Yet again, i'm a huge NASCAR fan so maybe i'm biased.",6
You have to have sex for it to follow you,10
It's one of the better well-received horror movies of the last decade though?,11
"Loved that movie, thought the ending was a bit shit though",2
Love this movie,1
Universally well liked.,1
I don’t think people hate this movie,9
"I really wanted to love this movie! 
When I watched the trailer, I was SO pumped for it. It looked like it was going to be amazing and it just fell so short for me. Shame! Glad you love it though.",2
"No one better hate this movie, it's a classic",33
"I haven't heard anyone speak ill of A Goofy Movie. Dafuq? If they do exist, I'd love to hear their reasoning.",9
That’s a banger movie!,7
No one dislikes that movie,5
My brother and I wore that VHS tape out.,1
Nice ending to your answer.,2
The first one was better,2
This was my preferred as well.,1
Thor was well received,7
"Isn't this like one of the highest rated movies ever? I forget, did it win an oscar?",5
The Hunt for Red October is overlooked?!? I always thought that movie was very well regarded right along with the Harrison Ford Jack Ryan films. The Affleck and Pine ones are the overlooked ones.,3
"Don't worry, you're not alone. I watch it every time it airs on TV.

Sean Connery as a Soviet captain, of Lithuanian descent and with a Scottish accent, is worth the watch alone. \^\^",2
Spider man 3 wasn't great but it was such a blast to watch,5
"I think we've established that ""ca-caw"" and ""tookie tookie"" don't work",2
there is no live action movie in Ba Sing Se,1
Terminator Salvation for me. I’d take more post-Judgement Day stories over new continuity like Dark Fate.,3
"I always wondered how the parents of the child who had Go To Hell Harry as an imaginary friend felt.  

Mom hears kid talking: ""Sweetie, who are you talking to?""

Kid: ""Go To Hell Harry!""",1
Every time I’ve showed this movie to someone they hate it. I don’t understand why.,1
Mine too,7
Why? I’m genuinely curious. I remember watching it long ago but I’m ambivalent to it. I know it’s panned but I honestly am not sure why beyond it being different from the comic.,1
LoEG was terrible on so many levels. Connery just dialed it in. The effects were goofy. It was bad.,1
"*we meet, we distrust, we argue, we fight a little, shit goes down, gotta work together now* yeah, you right",1
"To be fair, I think he would have sucked in both those movies so he made the right move. He really isn’t a great actor, it finally caught up with him.",1
I agree,1
There's an extended version?,1
"Yeah, it's perceived as a 'flop' because there was no way it could earn back the money it cost to make. It wasn't that nobody liked it.",1
"I swear I became aware of it as a kid because it was in the guiness book of records for biggest flop or something like that haha.

Never watched it myself. I fekking loved Deep Blue Sea, Mad Max and sorta dig The Postman so apparently I should be cool with it?",1
"I can hear that rocking intro theme now...

Dude, does anyone remember the fucking awesome cartoon show that followed up after? Well I'll be damned.. I know what I'm rewatching while recovering from surgery today.",1
A bit of extra umami to your eggs,1
Can I have some ice cream?,1
Put some funk in it,1
"Once you go duck, you don’t go back! Loooool",3
"Those duck tits looked fake as fuck, rubber duckies at best. That plastic surgeon must be a quack, I sure hope it didn't go on her bill",1
Serial Mom is fucking fantastic. My dad actually knew the guy who got (if I recall correctly) an AC unit dropped on his head (my dad worked in DC area advertising and a lot of local voiceover talent and recording techs show up in John Waters movies),1
Long live Serial Mom. Kathleen Turner is a legend.,1
"Serial Mom is amazing! Cry Baby is fun, and worth watching if only to see Iggy Pop bathing in a bucket.",1
"Serial Mom is fucking fantastic.

I grew up watching Hairspray, which I quite enjoyed. When I was older I watched some of his earlier stuff. You can see who he is as a filmmaker, but there’s of course a roughness around the edges. I liked them, but they’re also *definitely* an acquired taste.

I felt like Serial Mom hit a great balance of polished, funny, and insane. It’s probably my favorite movie of his.",1
I’m pretty sure that movie was just Guillermo del Toro’s adaptation of some kids playing with toy robots and dinosaurs.,1
"I love it too, but what is the difference between a film and a movie? I thought they were interchangeable words…",1
Sadly a big portion of the human race doesn't like Pacific Rim. They're wrong!,1
ENOUGH!,12
Enough!,7
"That'll be 4 bucks baby, you want fries with that!?",1
My ass…,6
Yes! I watched it religiously as a kid and still love it!,3
"We're about the same age, then; maybe I'm older by a year, but that's it.

I also loved it and, likewise, it's only years later that I heard this movie was one of the biggest box-office bombs of all-time.

Before the internet, only specialists knew about such things.",2
Especially for Batman and Robin!!!,1
"Among the good points, the cast was friendly. Arnold, George Clooney, Uma Thurman, Alicia Silverstone... By all accounts, they enjoyed working together.",1
And the GENIUS warping of the 20th Century Fox fanfare helps set the tone even before that!,1
Even AvP? *I love it*,1
They are both the same Movie really just surf and turf,3
"I loved the unique origin story. I loved it being so emotional. I loved Nick Nolte. I loved the comic panels. *hangs head in shame* I loved the Hulk Dogs.

I know, I know…",1
That don't hurt hahaha,2
Did you see the sequel oh man,2
Did you ever see little shop of horrors. If not do. It cost 2000 dollars and was made in a week. The dentist chair scene was a mistake they didn't have time or money to redo so they just left it in,2
">This movie suffers from not being what people expected.

Exactly this. People expected and wanted Ace Ventura and that simply wasn't gonna happen.",1
"$500, yooouuuuu want, $500?!?!?!",1
"Yeah this was my general feeling too; I didn’t hate what was there but wished there was more. I feel like it’s hard for even good directors like Sam Raimi to do something really out there and interesting within the Marvel formula (the only guy who seems able to do it semi-consistently is James Gunn). I feel like the biggest problem is that it takes a lot of time to properly set up and explore a multiverse, because you need to either limit your characters and environments (as EEAAO did), make very creative and efficient use of exposition and visuals (as EEAAO and the Spider-Verse movies did), or take a lot of time to properly set up multiple worlds, characters, variants, etc, and Marvel has done a mediocre job at best so far.",1
Dr Strange and the 2 Universe Field Trip,22
"Scarlet Witch killing the Illuminati was pretty dark. And the movie ends with a zombie Strange wearing a cloak of demons. I don’t know how horror you excepted an MCU movie to get, but I think your expectations were a bit unrealistic. I’m already preparing myself for Blade being way less dark than it should be.",1
"Another one that stuck with me - ""To see the world, things dangerous to come to, to see behind walls, draw closer, to find each other and to feel. That is the purpose of life.""",1
Thanks for that.,1
Am I not turtlely enough for the turtle club?,12
"Yes, yes, and yes.",1
I’ve never met anyone who doesn’t like Bring It On…,27
They do. This entire thread is karma farming. “I DONT CARE WHAT ANYONE SAYS! I LIKED LORD OF THE RINGS.”,10
I just said that in the same tone as the crazy choreography instructor who originally said it.,1
"So I like Quantumania as it’s own movie. As a stand-alone I think it is great. The reason I don’t like it (and the Loki series for that matter) is that it puts massive implications on all the movies that came before and seems like a dumb direction to take the MCU in. But JUST Quantumania? Yeah, it’s a good movie",6
I disagree. I've always delt with depression with humor. I don't understand why the folks say it needs to be one or the other.,9
"Good call. I forget exactly what my facebook post was after seeing Pixels but it was something like ""I should not have enjoyed this movie as much as I did.""",2
It’s the best - exactly as you say. Just relax and have a blast!,1
"It’s so cool, love that scene!",1
"Yeah, it just wasn't funny. My other problem with the movie was that no one could decide what they wanted it to be. At different points during its development/release, I saw it described as a reboot, a remake, a spiritual successor AND a new story that takes place in the same universe as the original movie. It was a mess.",8
"Check out r/moviescirclejerk. That movie combines so many of their least favorite things: Ryan Reynolds, Taika Waititi, pop-culture references, self-aware humor, sentimentality, and gaming culture.",2
Brutal,2
Correct and this can be said with at last half the movies listed lol,3
"I feel like this movie is VERY popular if you're a very specific age. Otherwise, you just haven't seen it.",15
lol right?! I love that scene where they are all at the psych office though that’s hilarious,1
I vaunt my burrd,7
"""Dialed it in"" doesn't mean what you think it does I think you mean ""phoned it in""",1
You two are adorable,1
"It's either called the extended cut or director's cut.

But yea, at the end, when the camera is zooming out on top of the mountain, it starts to zoom into a plaque in the ground that reads ""Mount Everest. Highest peak in the world""

So the Dry Land island is aftualy Everest.",1
"yes, and it's worth it",1
"For some reason, most people I've met that like The Postman also like Waterworld",1
"What flavour?


It doesn't matter. It's for my ass",1
And it was magnificent.,1
