comment,upvotes
"They are

But when people are talking about artistry, it's often that they use the word ""film""

And when they're discussing stuff that's just fun, they use movie

Like pacific rim and Godzilla are movies, and I love them dearly

Across the Spider verse is film. Same medium, but when it's done so beautifully it feels weird to compare the two. One is meant to be artistic and thoughtful, one is meant to be fun. And both can and should exist together, and they really shouldn't compete",1
He just left! With nuts!,1
"Yeah, that was great. Definitely.",1
"Probably not, it’s been a looooooooong time since I’ve seen the first one (back in the late 80’s/early 90’s). I’ll have to find it.",2
"Thirding that this was the problem. The whole Medieval Times sequence is amazing, but even as a kid, Chip's behavior unnerved me and definitely registered as very wrong and not something to treat lightly.",1
You ever been BITCH SLAPPED by an EIGHT ARM GODDESS?!,1
AT my old school we never used to travel through dimensions.,1
I quote that line frequently.,6
Sure I can agree with that,1
"Using humor to cope with depression isn't what I'm talking about though.  

They made a movie about a guy killing gods out of revenge for his dead child, and a protagonist fighting in spite of a terminal disease, and decided to make it a comedy.

Those are pretty heavy subjects for a comedy, and I didn't feel like they pulled it off.",4
People hate Ryan Reynolds and Taika Waititi….?,2
You're correct. I'm not sure why I said it that way.  Won't even edit.,1
Woo!,1
Awesome! Thanks for the info!,1
Exactly! I felt seven years old again after watching it!,1
You'll love it. It's worthy of the good weed that you hide when you're brother shows up,2
You three are great together,1
GDR!,1
