comment,upvotes
Drop Dead Fred,93
"Iron Man 2

Because of Tony realizing his dad loved him after all (and that he was his greatest gift) and also because I liked Ivan Vanko as a villain.",240
"I quite liked ‘The League of Extraordinary Gentlemen’ upon seeing it in the theater. 

I was genuinely shocked to see nearly every review (and Sean Connery’s career) disagree with me resoundingly.",375
Water world,256
Godzilla (1998),190
Super Mario 1992. It’s just a dark sci-fi movie with Mario references and I loved it as a kid,64
"Evolution. 

One of the funniest movies of my generation.",198
Howard The Duck,130
"David Lynch's 'Dune'.  


Perhaps its just nostalgia from watching it umpteen times as a kid but I absolutely adore the original Dune. Sure it has its flaws, but the atmosphere, sound, and general -weirdness- really brought to life Herbert's universe I think.",45
"Cry baby. Johnny starred in it to ""make fun of his fame"" and ended up more famous for it. He's cute af in it despite how cringey the movie is lol",38
"Pacific Rim. 
Giant robots fighting giant monsters! What's not to love? 

The sequel was shit though.",329
I really like the newer king Arthur..,75
"Kung Pow. 
My friends walked out of this one in the cinema while I was on the ground trying to not vomit from laughing so hard.",176
Surf Ninjas.,32
"Stop or my Mom Will Shoot.

Not even the star likes it.

I find it to be a light-hearted police comedy and it doesn't help that the titular Mom reminds me of my grandmother.",57
"*Cutthroat Island* \- More like, people have forgotten about it. This movie deserves a lot more than what it got, it's a good pirate flick!

*Batman & Robin*: it's a camp classic, and I will die on that hill.

*Die another day*: right, some special effects left to be desired and the second half went off the rails, plot-wise. Nevertheless, it's as enjoyable and as rewatchable as any Brosnan-Bond film.",26
Alien 3. Everything about it worked for me. Gonna go listen to the soundtrack now.,27
Waterworld/the postman,23
Hudson Hawk,21
The Village,22
Hulk (2003).,60
The A Team (2010),100
"Lucy

Everyone shits on this movie. And I agree the ""science"" is incredibly dumb. But that's not really the point. It's a fun and entertaining movie if you aren't expecting it to give you an accurate neuroscience lecture.",98
Attack of the killer tomatoes 🍅,17
"""The Shadow"" with Alec Baldwin.  Terrible online ratings, but it still makes me laugh.",18
"Any of the Star Wars sequel trilogy. I saw them all opening day, I enjoyed the heck out of all of them. Just rewatched them recently and, with a few ""I wish they had done this part different"" moments, I still really enjoyed them.

Had someone tell me I wasn't a real Star Wars fan for liking them and Solo. Had to inform them how mistaken they were... Lol",1
"The Cable Guy. This film is a contradiction of sorts I think. On one hand it appears to be a comedy of some type. Theres parts that are totally hysterical!

But if you look a little deeper and read between the lines this film could be considered a horror film. Its downright scary with the stalker aspect and hinting at the possibility of violence and death.

Also scary because the character that Jim Carrey portrays is a perfect reflection of people I have met in real life who are the same exact type of crazy that Chip Douglas is/was.",33
Waterworld,44
Bubble Boy with Jake Gyllenhaal. It hilarious,27
"Multiverse of Madness…oh, I’m sorry, was the movie about a magician traveling through the multiverse directed by Sam Raimi not as tight of a narrative as you wanted? You go to the butcher looking for vegan options as well?",127
"Secret life of Walter Mitty 

Defined my life for me.",69
Jupiter Ascending,36
"Thor Love and Thunder
(Also even while it's not hated but I think guardians of the Galaxy 3 was the best one)",13
Speed racer (the one that dropped in the 2000s),12
Movie 43,27
"The Master of Disguise

I loved it as a kid and didn't even know people hated it until I saw it on lists of the worst movies.",26
"The Amazing Spiderman 2

I genuinely found Andrew Garfield's portrayal of Spiderman pretty good

The storyline and production can get some work but for what its worth, garfield's spiderman was pretty genuine in it

The Harry Osborn actor was pretty damn good too, his ""crazy"" act when he went goblin was strong",11
"Austin Powers: The Spy Who Shagged Me

Everyone in my life hates it, but it’s clearly the best movie ever made.",30
[deleted],58
"Thor love and thunder. It's funny, I had fun, the kid had fun, it got Thor out of his funk. I think it sets the stage for him to come back in a less silly capacity so I appreciate the goofiness.",82
Freddy Got Fingered,37
"Dracula: Dead and Loving It. For some reason this one gets a ton of hate, but I think it's just as good (if not better) than RH: Men in Tights or other Mel Brooks movies of that period",9
"Little Nicky. I don't generally like Adam Sandler comedies, but that one is hilarious.",1
PIXELS,32
Indiana Jones and the Kingdom of the crystal skull,15
"Gravity.  

I’ll wait for the many haters of the film to respond.",22
"The Village. I thought the acting was good, and I liked the twist.",47
Terminator sequels after Judgment Day,6
"Wild Wild West. I loved it as a kid but found out only recently that it was a massive flop, I rewatched it and it’s a fun movie that doesn’t take itself too seriously.",7
The amazing Spider-Man 2,28
Batman v Superman,12
Multiverse of madness,6
"""The Happening"" \~ Everyone in my family hates it, while I enjoy it.",6
"The Village (2004), so much hate but I really liked it, and the soundtrack is just gorgeous!",6
"Across the Universe. People are pretty split, they either love it or really really hate it",6
Battleship is a banger.,16
"Chicken little, it's my childhood I could never hate it",18
"Extended editions of The Hobbit trilogy. Love the vibe of the first two. Honestly, I don't like most of the third.

Yes, they are obviously inferior to the LOTR movies... But there is so much right in them, too.",11
"Age of Ultron. 

Maybe it's bc I never read the comics and am also not super into the whole marvel universe (even at the start) but I liked that movie. I still like that movie. 

Only thing I disliked was the Nat/Banner love story. Thought that was dumb and forced and went no where...

But the story and characters made complete sense to me, and I though the humor was so well done.",25
"Shooter. Not a huge Wahlberg fan, but I thought Shooter was tight, suspenseful, and exactly what it set out to be…",6
Battleship I don't get the hate.,5
"John Carter

Not sure why it gets so much hate.  I enjoy it every time I watch it.  Is it brilliant?  No.  But a thoroughly enjoyable flick.",1
Con Air.,1
Twister,1
"Equilibrium. While the fight style is incredibly cheesy, I think it's a great movie that's similar to things like 1984 by George Orwell. Dystopian in a different way. The reviews are super bad, but I like it. Plus, Christian Bale is the main character.",1
Ghostbusters the female cast one.,42
Attack of the clones,9
Free Guy,35
"Grown Ups. I think it's a great family movie series, and it shows the importance of kids spending quality time with family and friends. Most people seem to hate Adam Sandler films, but I like them.",19
"Battleship, scientifically dumb as bag of hammers, but a lot of fun",4
Spawn 1997,4
Waterworld,4
Dracula Untold,4
Uglydolls,3
Den of Thieves. None of my friends seemed to like it but I really enjoyed it. The ratings were meh but I would give it like an 7.5/10. I really enjoyed it. And The Last Witchhunter was fun too but everybody I know actually hated it lol,3
The Lost World,3
"The karate kid 2010. Not as good as the original, but still entertaining",3
"Most recently it seems to be the “Uncharted” movie… I’m a huge fan of the games, and it would be hard (like with most video game adaptations) to make a great film out of it. But it was a fun little movie, I look at it like junk food, was it great and a historic piece of American cinema? No! But it didn’t have to be!",3
The Cat in the Hat movie. It’s ratings are so low on rotten tomatoes but it’s just a goofy little movie. I grew up watching it so it’ll always have a special place in my heart lol. No need to be a cinematic masterpiece,3
I’ve heard a lot of hate for con air and Nicolas cage in general. I love con air and I love me some Nicolas cage. I loved waterworld and jumper as well though jumper could have been a lot better I really liked the idea.,3
Punchdrunk.  I liked it.,3
Paul Blart Mall Cop,3
Fast & Furious tokyo drift,3
"Waterworld starring Kevin Costner.

It's literally a play on the ""what would happen if ALL the ice caps melted at once?"" question. I am unsure of how someone would be able to form gills if they were in the ocean for too long though.",3
"Across the Universe. People are pretty split, they either love it or really really hate it",3
"x men origins wolverine. Yeah it’s not comic accurate and has its dumb moments but it’s entertaining af, at least to me",3
“Kick Ass”,1
"Little Nicky

I know it's in vogue to shit on Adam Sandler films, and I find a lot of them hit and miss.

Perhaps it's because little nicky came out at the perfect time for me, that I found the particular blend of comedy to be perfect for my adolescent sense of humour. I still enjoy that film to this day, although I think it may be more for nostalgia sake",1
"Mars Attacks!
I think it's absolutely stupid. But it's so funny!",1
days of thunder,5
"Strangely, a lot of Best Picture winners that Reddit hates (The King’s Speech, Green Book, The Shape of Water, CODA).
 
Except Crash. Fuck that movie!",5
"It Follows. Yeah, the STD monster movie. I objectively know it sucks, but I find myself randomly coming up with survival tactics. And when I'm walking the halls of work alone and notice someone slowly walking behind me, it makes me wonder if it is following me.",8
"blair witch project.

I think it's a very clever movie. The way the tension rises and that you never see the baddies.",12
"After Earth. 
Watch that without thinking people won’t accept you.",5
Sausage party,5
A goofy movie I reckon,10
"Super Mario Brothers... The old one, not the new one.",4
"I'm was surprised to grow up and see the hate about Fight Club. 

 Yea, if you're not the target market, it's drawn out and pretentious.  But if one was the target market...well, I'm not supposed to talk about that.",8
Man of Steel,2
Gods of Egypt,2
Pacific Rim: Uprising is an amazing movie and I will die on this hill.,2
Tokyo Drift,2
2012,2
Rocky V. Probably my favorite Rocky after the first one.,2
"The remake of The Italian Job. I know, I know.",2
Ordinary People,2
"Antz.

I prefer it to Bugs Life but appreciate that’s not the common view. Nonetheless I think Antz got screwed by being released so close to Bugs Life, inviting the comparison. Probably having Woody Allen as the star voice hasn’t aged that well either…",2
The Pagemaster,2
Any Star Wars movie,2
"Movie 43

Look, I know it's not groundbreaking cinema and often relies on low hanging fruit for laughs but it does have genuinely funny moments and the story behind how it was made is fascinating.",2
Movie 43,2
Prometheus and Alien Covenant,2
every adam sandler movie,2
Cars 2,2
Nothing But Trouble,2
This thread is a great example of why art is subjective. I agree with lots of comments and am appalled by others haha.,2
Sucker Punch,2
"Valerian

I thought it definitely could have been done better but it was watchable",2
Interstellar,2
TRON legacy. It's my favorite movie. Jeff bridges is a god.,2
Godzilla 1998,2
Crystal Skull and Last Jedi,1
I thought Solo was pretty good,1
"Morbius. I can’t tell you how many people tell me to throw the movie away. I liked it, and it’s one of the few movies that I’ve rewatched multiple times. 

Also a bunch of Asylum films are good but terrible at the same time. No matter what genre they are labeled, they’re all comedy because of how bad and low budget they are.",1
"The Og Transformers movies, grew up on em and love watching them.",1
Tusk,1
"Doom. The 2005 version with The Rock and Karl Urban.

It's fun! Yes, it's completely different to the games, but I thoroughly enjoyed it.",1
"Exodus: Gods and Kings.

I am a *firm* atheist and I thought it was going to be a terrible film but I ended up loving it! Watched it like 3 times now lol.

Joel Edgerton as Ramses is a massively under-appreciated performance imo.",1
The shape of water,1
Tenet!,1
Battle Los Angeles,1
Highschool Musical series. It's just make go back in time. When I used to hate it but enjoy it at the same time.,1
Pootie Tang,1
Year One and Land of the Lost.,1
Any Zack Snyder movie,1
Batman v Superman Ultimate Edition,1
Star Trek V the final frontier,1
There is literally no unpopular opinion here 😭,1
Anchorman 2,1
Alien Resurrection.,1
Death to Smoochy.,1
Rubber,1
"Throw Mama From The Train  


Hear No Evil, See No Evil",1
Little Nicky,1
Sucker Punch!,1
Punch Drunk Love,1
"All my friends are, while not really hating, really disliking Children of Men, while it is (from what I can tell) universally liked, and it is defo in my top5 movies and I always recommend it.",1
Super Mario 1992. It’s just a dark sci-fi movie with Mario references and I loved it as a kid,1
Battleship,1
Thor and Thor 2,6
I still enjoy the 80s super Mario Brothers movie,3
Emoji movie (2017),4
I'm thinking of ending things.,3
Daredevil (2003). It's over the top as hell and filled with butt rock.,1
[deleted],3
Any of the MCU movies apparently.,5
"Spider Man 3 (Tobey Maguire) and Catwoman. Yes, they may be goofy, but I still find them fun to watch.",3
Evolution.,3
"I'm not sure if EVERYONE hates it but it's controversial: The Whale. Personally I enjoyed it and thought the directing and the acting was incredible, certainly Brendan Fraser's performance is worthy of an award. The film gives you a lot to think about, and hits you in the feels.",3
Old,2
Spiderman 3,2
Beethoven (the saint bernard doggi),2
"Most M. Night movies besides The Last Airbender. Not a single person could predict his twist endings, which is a sign of good writing. The cinematography of his movies have lots of symmetry and rule of thirds, which result in some beautifully shot scenes. His ideas are original which is something Hollywood is currently in desperate need of. I also really like that his movies aren’t full blown science fiction. It’s plausible that aliens could invade like Signs, it’s plausible that nature could kick on its self defense system and start killing humans, it’s plausible there’s a community of people cut off from the world and still think it’s the 1700s. I like his movies a lot and he was reason I became interested in film to begin with",2
Titanic,1
I remember genuinely loving the Avatar live action movie in cinemas as a child 💀💀💀,1
Sucker Punch,1
Terminator 3 and Jurassic Park 3,2
Everyone I know hated Dune (2021). I loved it.,2
This is my favorite movie,16
I refer to my nephew as 'snotface' on the regular.,1
Did people not like this movie?,1
Who hated this movie? WHO? It’s so good.,1
And this is for ruining the one schtoop a month I get while Murray's wife is out of town!,1
"*holds up purple dress* “This will look good at the wine gala.”

*Fred pops in* “Yeah, looks loik a big *brewze* (:”",1
"Ah rest in peace, Rik Mayall.",1
"That's a good movie, weird, but good",1
I liked the suitcase suite lol,28
"I was going to say this.  Based on Reddit, you'd think this was a garbage movie.  To me it's about as good as the first Iron Man movie.  Venko and Hammer are fun villains, there's funny scenes (where the humor actually lands), there's great action, nice character development for Stark, nice intro for Black Widow. I don't know why it gets the hate it does.  I definitely put it above IM3.",1
It's my favorite Iron Man movie,24
I don't think it is the best Iron Man movie but it's definitely the most 'Tony Stark' movie,14
Bird,1
It has that awesome suitcase armor!,1
Plus Black Widow taking out a bunch of bad guys while Happy is trying to deal with one.,1
"I remember the dissent at the time was that it was less of an iron man sequel and more of an ad for future avengers projects

a lot of the negativity around it was from people used to comic book movies being isolated, self contained stories, and the interconnectivity we're used to now was brand new

I think a lot of the iron man 2 haters from its release would no longer have this problem with it",1
Oh. I didn’t realize it was widely hated. It’s a good movie. 🤷‍♂️,52
Upvoting because I truly hated this movie,46
Oooo - bold choice,12
"It was part of that wave of campy blockbusters eg The Mummy, Van Hellsing so i didn't mind it was fun",1
"I love that one, it's such a fun movie! I know it isn't as good as infinity war, endgame, or other various comic book movies, but I still have a good time when I watch it. And most importantly, it's never morbin time in the league",1
"I really enjoyed The League of Extraordinary Gentlemen and found all the literary references amusing. Still don’t really understand why it’s panned. Though I never read the comics, so maybe in comparison it’s a letdown? 

Also, the first 2 acts of The Avengers (2012) is almost beat for beat the same.",1
"Good concept, mediocre execution. The frustrating part is that Connery turned down Gandalf because he didn’t get it. He turned down another later-iconic role because he didn’t get it (IDR which). He didn’t get LOEG so he went for it.",2
"I really loved it, I feel like they could’ve done a lot more with it and that was very frustrating but it’s actually one of my feel good movies.",1
water world was good,57
Mad Max at Sea world,1
"You gotta watch the extended version, though. It adds a lot more to the story.",1
Came here for this.  I think most people panned it mostly due to its insanely high budget for the time.  Similar to John Carter.,1
People don't like it?,1
This was a great movie,1
Came here to say this,1
Oh my god I watched this for the Nth time a few months ago and it still slaps,1
This was going to be my answer too!  Waterworld was legit one of my favorite movies as a child.,1
Paper,1
"I saw that movie six times, it rules!!",1
For you,1
"I see your Water World and raise you the Postman, which I unironically love",1
"It's been ages since I've seen the whole movie, but for a while there it was basically on heavy rotation on cable, and if I was flipping and Waterworld was on, I would 100% watch the rest of it.",1
"I feel like a lot of people (not all) have an opinion of the movie based on reviews and the fact it lost so much money and was seen as a waste, even though the reason production cost so much was that they had to rebuild an entire set after it was destroyed by a hurricane.",1
Is that the one where Godzilla lays eggs in MSG? That one was dope.,57
"i loved this movie! Not seen the later ones, but always loved the 1998 one.",14
Same,12
2nd best Mathew Broderick role behind Ferris Buehler's Day Off,1
bro that was a great movie how do people not like it,5
I’ll admit it’s a good movie on its own. It’s just that Godzilla 98 is pretty different of being a actual Godzilla though. It’s a fun movie on its own but it is too different to be a actual Godzilla Film design-wise in my opinion. Still good film though to be honest..,1
"It’s Gojira, you moron! (It’s a quote don’t get mad)",1
"I rhought this was great. And on the VHS tape I recorded it on, I labeled the sticker as Super Mario Bros: A Very Cool Movie. And outlined it and drew Mario shit around it. I really liked that movie.",1
*There's always time for lubricant!*,44
"I think we've established that ca-caw and tookie-tookie don't work.

Hilarious movie!",47
Take the leg! Take the leg!,1
They gave the giant starfish a shampoo enema!!! How the hell is that not funny!,1
“He’s giving her a bit of the Cain madness…”,1
I remember it being semi-entertaining when it came out. Watched it recently with my son and I was howling throughout! David Duchovny and Orlando Jones have amazing chemistry.,1
Haaaaarrryyy. His little jiggle dance,1
I didn't know people hated that movie,1
"I loved it when it came out, and I rewatched it a few years ago. It aged surprisingly well.",1
The real beginning of the MCU series,56
This was my first time ever seeing tits. Duck tits.,8
This was mine as well.  Really enjoy this movie a lot of people seemed to hate.,1
Love it!,1
"Man I love that movie, you just gotta see it as one of the good bad movies, like convoy",2
"Sting shouting ""I WILL KILL HIM"" = hilarious.",1
Dune is a guilty pleasure. Coworker of mine and I have been demanding a cameo by Sting in the new one because of it.,1
I loved it. I saw it as a David Lynch interpretation of the book,1
Really wish his Lynch's original cut of that movie was out there somewhere.,1
"It's probably because I'm from Baltimore, but I love all of John Waters' terrible movies

Serial Mom gets a lot of hate, but Kathleen Turner is so great in it",19
">despite how cringey the movie is

This is a John Waters movie, so the exaggerated campiness is definitely intentional.  If you like Cry Baby, try **Hairspray (1988)**, which is a masterpiece.",1
"I love the movie, but my daughter was just... *confused*.",3
"I loved that movie when I was a teenager in the 2000s. Then I rewatched a few clips of it recently, and it just didn't feel the same anymore.",1
I just rewatched it for the first time in decades a few weeks ago and learned that Willem Dafoe plays the prison guard 🤯,1
"If my 10 year old self could have come up with a pitch for a film, it would have been Pacific rim. Giant robots fighting giant dinosaurs because who cares let them fight. Love it.",62
"Who doesn't like Pacific rim? I need names and addresses. This movie is awesome! Terrible film, great movie!",54
Did you watch the pacific rim the black? It's pretty nice.,5
I love pacific rim and the lore around it. I do not love Charlie Hunnam though. His speech and personality are very monotone. He was more robotic than the robots.,7
Everybody loved that film what?,3
"The Netflix anime was pretty good, if you can don't mind anime.",2
"When I made one of my first big boy purchases and got a legit Dolby Atmos surround sound set up and a big screen tv, that was the first movie I wanted to watch to test it out. Did not disappoint",1
Pacific Rim is a hugely popular film...,1
At first I was like wtf am I watching? Then I noticed it was a Guy Ritchie film and suddenly everything made sense. Jude Law also pretty much nails everything.,21
"The one where goes into the avatar state whenever he touches the sword? Yeah, guilty pleasure.",19
The scenes where he berserk mode with the sword is awesome!,7
"The one with Charlie Hunman is my favorite. Awesome story, visceral action, and not purely focused on magic.",3
I saw it without hearing anything about it and it was fucking great. Who doesn't like badass beat em up movies,1
"Guy Ritchie’s King Arthur?

I liked the first half but then the second half was a bit too paranormal/demon like for my taste and broke with reality a bit.

The soundtrack was absolutely bangin, I loved the training song montage where they include his heavy breathing as part of the beat in the song",1
People didn’t like this??,1
"First, a joke. What do you get when you cross an owl with a bungee cord? My ass! Nyah ha ha! Ha ha!",44
"""I'm the Chosen One, outside the walls!""

""Your mouth tricks won't work on me ventriloquists.""",23
Weew weew weew weew weew,1
"Over 20 years later and sometimes I'll still mumble the ""Taco Bell, Taco Bell, product placement with Taco Bell. Enchirito, nacho burrito!"" song to myself.",27
That’s a lot of nuts!,23
"I’m am bleeding, making me victor.",10
"I worked with the guy who animated the cow fight scene. He’s an older guy and it embarrassed him to no end that he had to make that. It was fun to bring up now and then. But also, he had such an impressive list of projects. He worked on the matrix and all the shriek movies as well as other dream work properties. So he had plenty to be proud of.",1
It’s amazing.  One of my fave movies of all time.,17
Tiger. Tiger. Birdy. Birdy.,16
take me man meat!,7
What do you get when cross an owl with a bungee cord?,6
"""I have **chosen** the large \[popcorn\] tub.""",1
Kung Pow: Enter the Fist is a fuckin masterpiece in parody,1
"This one has been a rollercoaster for me. When it came out (when I was 14ish?), I thought it looked terrible. Then, a year or two later, I saw it and loved it, watching it over and over. Then, I watched it in my late 20s and did not enjoy it. But now, whenever I see memes/references to it, I feel like ""hmm, maybe it is funny.""",12
One of the best comedies ever,1
"We have purposely trained him wrong, as a joke.

If you’ve got an ass I’ll kick it!",1
Love the scene where the lady starts applying lemons and salt to his wound.,1
tongue hahahaha,1
WEEE OHH!!,1
"ive loved this movie my whole life since i was a kid, my wife hated it",1
Great pick!,2
There's a solid half hour in that movie,2
I LOVE that movie!,6
“Brothers don’t surf.”,1
"Hi this is Colonel Chi, I'm not in right now but if you leave your name and number and the time that you called I'll get right back to ya. And DON'T HANG UP!!",1
I just watched 3 Ninjas last week. Was waiting for an app to show it for free. But found the whole movie on YouTube,1
There's no shame in liking this movie. It is a classic.,1
Motosuuuuuurf!!!,1
"Arnold actually pranked Stallone into taking the role. He faked interest in it so that Stallone would take it, and the rest is cinema history

source: Stallone",18
Estelle Getty is a treasure.,11
Agreed!,5
Ha me too. I loved the movie and she also reminds me of my grandma,1
